ID,Title,User Story,Story Points,Priority,MoSCoW,Epic,Dependencies,Tags,Sprint
MDA-001,Create Model-Driven App & Site Map,"As a developer, I want a Model-Driven App created in the PowerOne solution with a configured site map, so that administrators have a dedicated interface for managing master data.",3,P1,Must Have,Admin App,"US-001;US-002",model-driven-app;infrastructure;site-map,1
MDA-002,Organizational Unit Management,"As an admin, I want forms and views for managing organizational units in the Model-Driven App, so that the org hierarchy is maintained through a purpose-built admin interface.",3,P1,Must Have,Admin App,MDA-001,model-driven-app;forms;views;org-units,2
MDA-003,Sprint Management,"As an admin, I want forms and views for managing sprints in the Model-Driven App, so that time periods are properly configured for OKR cycles.",3,P1,Must Have,Admin App,MDA-001,model-driven-app;forms;views;sprints,2
MDA-004,User-OrgUnit Assignment,"As an admin, I want to manage user-organizational unit assignments through the Model-Driven App, so that team membership is maintained for filtering and user context in the Canvas App.",2,P1,Must Have,Admin App,MDA-002,model-driven-app;relationships;n-n,2
MDA-005,Admin Dashboard,"As an admin, I want a dashboard in the Model-Driven App with overview charts and quick actions, so that I can monitor master data health at a glance.",2,P1,Must Have,Admin App,"MDA-002;MDA-003",model-driven-app;dashboard;charts,2
MDA-006,Security Configuration & Testing,"As an admin, I want security roles properly configured for the Model-Driven App, so that only authorized administrators can access and modify master data.",2,P1,Must Have,Admin App,MDA-001,model-driven-app;security;testing,1
